{
  "schema_version": "inbound.v1",
  "provider": "mock",
  "provider_message_id": "mmsg_0002",
  "line_id": "line_a1",
  "from_handle": "+15551234567",
  "user_id": "usr_demo0001",
  "received_at": "2026-08-02T12:04:02Z",
  "kind": "text",
  "text": "2",
  "tapback": null,
  "reply_to_message_id": "omsg_9001",
  "protocol": "imessage",
  "trace_id": null
}
