{
  "schema_version": "inbound.v1",
  "provider": "mock",
  "provider_message_id": "mmsg_0001",
  "line_id": "line_a1",
  "from_handle": "+15551234567",
  "user_id": null,
  "received_at": "2026-08-01T13:02:11Z",
  "kind": "text",
  "text": "481902",
  "tapback": null,
  "reply_to_message_id": null,
  "protocol": "imessage",
  "trace_id": "00-4bf92f3577b34da6a3ce929d0e0e4736-00f067aa0ba902b7-01"
}
